{
  "id": "ga-prod-beverage-001",
  "name": { "en": "Sparkling Hemp Seltzer" },
  "product_form": "beverage",
  "regulatory_class": "hemp_derived",
  "packages": [
    {
      "package_id": "ga-pkg-beverage-001",
      "sku": "GHB-12OZ",
      "net_contents": { "value": 12, "unit": "fl_oz" },
      "lab_result": {
        "coa_id": "ga-coa-beverage-001",
        "tested_at": "2026-03-15T00:00:00Z",
        "public_url": "https://coa.example.com/ga-coa-beverage-001",
        "overall_pass": true,
        "contaminants_passed": true,
        "cannabinoids": [
          { "code": "THC", "value": 8, "unit": "mg", "basis": "per_serving" },
          { "code": "CBD", "value": 20, "unit": "mg", "basis": "per_serving" },
          { "code": "CBDA", "value": 1, "unit": "mg", "basis": "per_serving" },
          { "code": "CBG", "value": 2, "unit": "mg", "basis": "per_serving" },
          { "code": "CBGA", "value": 0.5, "unit": "mg", "basis": "per_serving" },
          { "code": "CBN", "value": 0.2, "unit": "mg", "basis": "per_serving" },
          { "code": "HHC", "value": 0, "unit": "mg", "basis": "per_serving" }
        ]
      }
    }
  ]
}
